,Domain,Wikipedia Link,Title,Context,Type,Question,Answer
1267,List of writers who either speak or write in hindi,https://hi.wikipedia.org/wiki/%E0%A4%9A%E0%A4%A8%E0%A5%8D%E0%A4%A6%E0%A5%8D%E0%A4%B0%E0%A4%A7%E0%A4%B0_%E0%A4%B6%E0%A4%B0%E0%A5%8D%E0%A4%AE%E0%A4%BE_%27%E0%A4%97%E0%A5%81%E0%A4%B2%E0%A5%87%E0%A4%B0%E0%A5%80%27,चन्द्रधर शर्मा 'गुलेरी',"चन्द्रधर शर्मा 'गुलेरी' (७ जुलाई १८८३ - १२ सितम्बर १९२२) हिन्दी के कथाकार, व्यंगकार तथा निबन्धकार थे।
चंद्रधर शर्मा गुलेरी का जन्म राजस्थान की वर्तमान राजधानी जयपुर में हुआ था। उनके पिता पंडित शिवराम शास्त्री मूलतः हिमाचल प्रदेश के गुलेर गाँव के निवासी थे। ज्योतिर्विद महामहोपाध्याय पंडित शिवराम शास्त्री राजसम्मान पाकर जयपुर (राजस्थान) में बस गए थे। उनकी तीसरी पत्नी लक्ष्मीदेवी ने सन् 1883 में चन्द्रधर को जन्म दिया।
चंद्रधर को घर में ही  संस्कृत भाषा, वेद, पुराण आदि के अध्ययन, पूजा-पाठ, संध्या-वंदन तथा धार्मिक कर्मकाण्ड का वातावरण मिला। आगे चलकर उन्होंने अंग्रेज़ी शिक्षा भी प्राप्त की।
आगे की पढ़ाई के लिए वे इलाहाबाद आ गए जहाँ प्रयाग विश्वविद्यालय से बी. ए. किया। उन्होंने कलकत्ता विश्वविद्यालय से एम. ए. किया। चाहते हुए भी वे आगे की पढ़ाई परिस्थितिवश जारी न रख पाए हालाँकि उनके स्वाध्याय और लेखन का क्रम अबाध रूप से चलता रहा। बीस वर्ष की उम्र के पहले ही उन्हें जयपुर की वेधशाला के जीर्णोद्धार तथा उससे सम्बन्धित शोधकार्य के लिए गठित मण्डल में चुन लिया गया था और कैप्टन गैरेट के साथ मिलकर उन्होंने ""द जयपुर ऑब्ज़रवेटरी एण्ड इट्स बिल्डर्स"" शीर्षक अंग्रेज़ी ग्रन्थ की रचना की।
अपने अध्ययन काल में ही उन्होंने सन् 1900 में जयपुर में नागरी मंच की स्थापना में योग दिया और सन् 1902 से मासिक पत्र ‘समालोचक’ के सम्पादन का भार भी सँभाला। प्रसंगवश कुछ वर्ष काशी की नागरी प्रचारिणी सभा के सम्पादक मंडल में भी उन्हें सम्मिलित किया गया। उन्होंने देवी प्रसाद ऐतिहासिक पुस्तकमाला और सूर्य कुमारी पुस्तकमाला का सम्पादन किया और नागरी प्रचारिणी पुस्तकमाला और सूर्य कुमारी पुस्तकमाला का सम्पादन किया और नागरी प्रचारिणी सभा के सभापति भी रहे।
जयपुर के राजपण्डित के कुल में जन्म लेनेवाले गुलेरी जी का राजवंशों से घनिष्ठ सम्बन्ध रहा। वे पहले खेतड़ी नरेश जयसिंह के और फिर जयपुर राज्य के सामन्त-पुत्रों के अजमेर के मेयो कॉलेज में अध्ययन के दौरान उनके अभिभावक रहे। सन् 1916 में उन्होंने मेयो कॉलेज में ही संस्कृत विभाग के अध्यक्ष का पद सँभाला। सन् 1920 में पं॰ मदन मोहन मालवीय के प्रबंध आग्रह के कारण उन्होंने बनारस आकर काशी हिन्दू विश्वविद्यालय के प्राच्यविद्या विभाग के प्राचार्य और फिर 1922 में प्राचीन इतिहास और धर्म से सम्बद्ध मनीन्द्र चन्द्र नन्दी पीठ के प्रोफेसर का कार्यभार भी ग्रहण किया।
इस बीच परिवार में अनेक दुखद घटनाओं के आघात भी उन्हें झेलने पड़े। सन् 1922 में 12 सितम्बर को पीलिया के बाद तेज ज्वर से मात्र 39 वर्ष की अल्पायु में उनका देहावसान हो गया।
इस थोड़ी-सी आयु में ही गुलेरी जी ने अध्ययन और स्वाध्याय के द्वारा हिन्दी और अंग्रेज़ी के अतिरिक्त संस्कृत प्राकृत बांग्ला मराठी आदि का ही नहीं जर्मन तथा फ्रेंच भाषाओं का ज्ञान भी हासिल किया था। उनकी रुचि का क्षेत्र भी बहुत विस्तृत था और धर्म, ज्योतिष इतिहास, पुरातत्त्व, दर्शन भाषाविज्ञान शिक्षाशास्त्र और साहित्य से लेकर संगीत, चित्रकला, लोककला, विज्ञान और राजनीति तथा समसामयिक सामाजिक स्थिति तथा रीति-नीति तक फैला हुआ था। उनकी अभिरुचि और सोच को गढ़ने में स्पष्ट ही इस विस्तृत पटभूमि का प्रमुख हाथ था और इसका परिचय उनके लेखन की विषयवस्तु और उनके दृष्टिकोण में बराबर मिलता रहता है।
39 वर्ष की जीवन-अवधि में उन्होंने  कहानियाँ, लघु-कथाएँ, आख्यान, ललित निबन्ध, गम्भीर विषयों पर विवेचनात्मक निबन्ध, शोधपत्र, समीक्षाएँ, सम्पादकीय टिप्पणियाँ, पत्र विधा में लिखी टिप्पणियाँ, समकालीन साहित्य, समाज, राजनीति, धर्म, विज्ञान, कला आदि पर लेख तथा वक्तव्य, वैदिक/पौराणिक साहित्य, पुरातत्त्व, भाषा आदि पर प्रबन्ध, लेख तथा टिप्पणियाँ लिखीं। उनकी सर्वाधिक प्रसिद्ध कहानी  ‘उसने कहा था’ का प्रकाशन सरस्वति में 1915 ई. में हुआ। उन्होंने  ‘कछुआ धरम’ और ‘मारेसि मोहि कुठाऊँ’ नामक  निबंध और पुरानी हिन्दी नामक लेखमाला भी लिखी। ‘महर्षि च्यवन का रामायण’ उनकी शोधपरक पुस्तक
उनके लेखन की रोचकता उसकी प्रासंगिकता के अतिरिक्त उसकी प्रस्तुति की अनोखी भंगिमा में भी निहित है। उस युग के कई अन्य निबन्धकारों की तरह गुलेरी जी के लेखन में भी मस्ती तथा विनोद भाव एक अन्तर्धारा लगातार प्रवाहित होती रहती है। धर्मसिद्धान्त, अध्यात्म आदि जैसे कुछ एक गम्भीर विषयों को छोड़कर लगभग हर विषय के लेखन में यह विनोद भाव प्रसंगों के चुनाव में भाषा के मुहावरों में उद्धरणों और उक्तियों में बराबर झंकृत रहता है। जहाँ आलोचना कुछ अधिक भेदक होती है, वहाँ यह विनोद व्यंग्य में बदल जाता है-जैसे शिक्षा, सामाजिक, रूढ़ियों तथा राजनीति सम्बन्धी लेखों में इससे गुलेरी जी की रचनाएँ कभी गुदगुदाकर, कभी झकझोरकर पाठक की रुचि को बाँधे रहती हैं।
गुलेरी जी की शैली मुख्यतः वार्तालाप की शैली है जहाँ वे किस्साबयानी के लहजे़ में मानो सीधे पाठक से मुख़ातिब होते हैं। यह साहित्यिक भाषा के रूप में खड़ी बोली को सँवरने का काल था। अतः शब्दावली और प्रयोगों के स्तर पर सामरस्य और परिमार्जन की कहीं-कहीं कमी भी नज़र आती है। कहीं वे ‘पृश्णि’, ‘क्लृप्ति’ और ‘आग्मीघ्र’ जैसे अप्रचलित संस्कृत शब्दों का प्रयोग करते हैं तो कहीं ‘बेर’, ‘बिछोड़ा’ और ‘पैंड़’ जैसे ठेठ लोकभाषा के शब्दों का। अंग्रेज़ी अरबी-फारसी आदि के शब्द ही नहीं पूरे-के-पूरे मुहावरे भी उनके लेखन में तत्सम या अनूदित रूप में चले आते हैं। पर भाषा के इस मिले-जुले रूप और बातचीत के लहज़े से उनके लेखन में एक अनौपचारिकता और आत्मीयता भी आ गई है। हाँ गुलेरी जी अपने लेखन में उद्धरण और उदाहरण बहुत देते हैं। इन उद्धरणों और उदाहरणों से आमतौर पर उनका कथ्य और अधिक स्पष्ट तथा रोचक हो उठता है पर कई जगह यह पाठक से उदाहरण की पृष्ठभूमि और प्रसंग के ज्ञान की माँग भी करता है आम पाठक से प्राचीन भारतीय वाङ्मय, पश्चिमी साहित्य, इतिहास आदि के इतने ज्ञान की अपेक्षा करना ही गलत है। इसलिए यह अतिरिक्त ‘प्रसंगगर्भत्व’ उनके लेखन के सहज रसास्वाद में कहीं-कहीं अवश्य ही बाधक होता है।
बहरहाल गुलेरी जी की अभिव्यक्ति में कहीं भी जो भी कमियाँ रही हों, हिन्दी भाषा और शब्दावली के विकास में उनके सकारात्मक योगदान की उपेक्षा नहीं की जा सकती। वे खड़ी बोली का प्रयोग अनेक विषयों और अनेक प्रसंगों में कर रहे थे-शायद किसी भी अन्य समकालीन विद्वान से कहीं बढ़कर। साहित्य पुराण-प्रसंग इतिहास, विज्ञान, भाषाविज्ञान, पुरातत्त्व, धर्म, दर्शन, राजनीति, समाजशास्त्र आदि अनेक विषयों की वाहक उनकी भाषा स्वाभाविक रूप से ही अनेक प्रयुक्तियों और शैलियों के लिए गुंजाइश बना रही थी। वह विभिन्न विषयों को अभिव्यक्त करने में हिन्दी की सक्षमता का जीवन्त प्रमाण है। हर सन्दर्भ में उनकी भाषा आत्मीय तथा सजीव रहती है, भले ही कहीं-कहीं वह अधिक जटिल या अधिक हलकी क्यों न हो जाती हो। गुलेरी जी की भाषा और शैली उनके विचारों की अभिव्यक्ति का माध्यम मात्र नहीं थी। वह युग-सन्धि पर खड़े एक विवेकी मानस का और उस युग की मानसिकता का भी प्रामाणिक दस्तावेज़ है। इसी ओर इंगित करते हुए प्रो॰ नामवर सिंह का भी कहना है, ‘‘गुलेरी जी हिन्दी में सिर्फ एक नया गद्य या नयी शैली नहीं गढ़ रहे थे बल्कि वे वस्तुतः एक नयी चेतना का निर्माण कर रहे थे और यह नया गद्य नयी चेतना का सर्जनात्मक साधन है।’’
अपने और आधुनिकता’ समकालीन सामाजिक, राजनीतिक और धार्मिक स्थितियों से उनके गम्भीर जुड़ाव और इनसे सम्बद्ध उनके चिन्तन तथा प्रतिक्रियाओं में स्पष्ट होती है। उनका सरोकार अपने समय के केवल भाषिक और साहित्यिक आन्दोलनों से ही नहीं, उस युग के जीवन के हर पक्ष से था। किसी भी प्रसंग में जो स्थिति उनके मानस को आकर्षित या उत्तेजित करती थी, उस पर टिप्पणी किए बगैर वे रह नहीं पाते थे। ये टिप्पणियाँ उनके सरोकारों, कुशाग्रता और नज़रिये के खुलेपन की गवाही देती हैं। अनेक प्रसंगों में गलेरी जी अपने समय से इतना आगे थे कि उनकी टिप्पणियाँ आज भी हमें अपने चारों ओर देखने और सोचने को मज़बूर करती हैं।
‘खेलोगे कूदोगे होगे खराब’ की मान्यता वाले युग में गुलेरी जी खेल को शिक्षा का सशक्त माध्यम मानते थे। बाल-विवाह के विरोध और स्त्री-शिक्षा के समर्थन के साथ ही आज से सौ साल पहले उन्होंने बालक-बालिकाओं के स्वस्थ चारित्रिक विकास के लिए सहशिक्षा को आवश्यक माना था। ये सब आज हम शहरी जनों को इतिहास के रोचक प्रसंग लग सकते हैं किन्तु पूरे देश के सन्दर्भ में, यहाँ फैले अशिक्षा और अन्धविश्वास के माहौल में गुलेरी जी की बातें आज भी संगत और विचारणीय हैं। भारतवासियों की कमज़ोरियाँ का वे लगातार ज़िक्र करते रहते हैं-विशेषकर सामाजिक राजनीतिक सन्दर्भों में। हमारे अधःपतन का एक कारण आपसी फूट है-‘‘यह महाद्वीप एक दूसरे को काटने को दौड़ती हुई बिल्लियों का पिटारा है’’ (डिनामिनेशन कॉलेज : 1904) जाति-व्यवस्था भी हमारी बहुत बड़ी कमज़ोरी है। गुलेरी जी सबसे मन की संकीर्णता त्यागकर उस भव्य कर्मक्षेत्र में आने का आह्वान करते हैं जहाँ सामाजिक जाति भेद नहीं, मानसिक जाति भेद नहीं और जहाँ जाति भेद है तो कार्य व्यवस्था के हित (वर्ण विषयक कतिपय विचार : 1920)। छुआछूत को वे सनातन धर्म के विरुद्ध मानते हैं। अर्थहीन कर्मकाण्डों और ज्योतिष से जुड़े अन्धविश्वासों का वे जगह-जगह ज़ोरदार खण्डन करते हैं। केवल शास्त्रमूलक धर्म को वे बाह्यधर्म मानते हैं और धर्म को कर्मकाण्ड से न जोड़कर इतिहास और समाजशास्त्र से जोड़ते हैं। धर्म का अर्थ उनके लिए ‘‘सार्वजनिक प्रीतिभाव है’’ ‘‘जो साम्प्रदायिक ईर्ष्या-द्वेष को बुरा मानता है’’ (श्री भारतवर्ष महामण्डल रहस्य : 1906)। उनके अनुसार उदारता सौहार्द और मानवतावाद ही धर्म के प्राणतत्त्व होते हैं और इस तथ्य की पहचान बेहद ज़रूरी है-‘‘आजकल वह उदार धर्म चाहिए जो हिन्दू, सिक्ख, जैन, पारसी, मुसलमान, कृस्तान सबको एक भाव से चलावै और इनमें बिरादरी का भाव पैदा करे, किन्तु संकीर्ण धर्मशिक्षा...(आदि) हमारी बीच की खाई को और भी चौड़ी बनाएँगे।’’ (डिनामिनेशनल कॉलेज : 1904)। धर्म को गुलेरी जी बराबर कर्मकाण्ड नहीं बल्कि आचार-विचार, लोक-कल्याण और जन-सेवा से जोड़ते रहे।",,,
