,Domain,Wikipedia Link,Title,Context,Type,Question,Answer
1260,List of writers who either speak or write in hindi,https://hi.wikipedia.org/wiki/%E0%A4%85%E0%A4%B0%E0%A5%81%E0%A4%A3_%E0%A4%B6%E0%A5%8C%E0%A4%B0%E0%A5%80,अरुण शौरी,"अरुण शौरी  (जन्म : २ नवम्बर १९४१) भारत के प्रसिद्ध पत्रकार, लेखक, बुद्धिजीवी एवं राजनेता हैं। वे विश्व बैंक में अर्थशास्त्री थे (1968-72 और 1975-77) ; भारत के योजना आयोग में सलाहकार थे; इण्डियन एक्सप्रेस एवं टाइम्स ऑफ इण्डिया नामक अंग्रेजी पत्रों के सम्पादक थे; तथा सन् १९९८-२००४ तक भारत सरकार में मंत्री थे।
अरुण शौरी का जन्म पंजाब के जालंधर में सन 1941 ईस्वी वमें हुआ। इन्होंने दिल्ली के सेंट स्टीफेंस कॉलेज में शिक्षा पाई. ऊंची शिक्षा के लिए वे अमेरिका गए। जहां सिराक्यूज विश्वविद्यालय से अर्थशास्त्र में डॉक्ट्रेट की डिग्री ली।
राजग सरकार में उन्होंने विनिवेश, संचार एवं सूचना प्रौद्योगिकी मंत्रालयों सहित कई अन्य विभागों में कार्यभार संभाला. अरुण शौरी इंडियन एक्सप्रेस के संपादक रह चुके हैं।
उनको भारत सरकार द्वारा सन १९९० में साहित्य एवं शिक्षा के क्षेत्र में पद्मभूषण से सम्मानित किया गया था। बिजनेस वीक ने वर्ष 2002 में उन्हें स्टार ऑफ इंडिया से सम्मानित किया तथा दि इकॉनोमिक टाइम्स ने उन्हें द बिजनेस लीडर ऑफ द ईयर चुना गया। रेमन मैग्सेसे, दादाभाई नौरोजी पुरस्कार, फ्रीडम टू पब्लिक अवार्ड, एस्टर पुरस्कार, इंटरनेशनल एडिटर ऑफ द ईयर अवार्ड से भी उन्हें सम्मानित किया जा चुका है।",,,
1261,List of writers who either speak or write in hindi,https://hi.wikipedia.org/wiki/%E0%A4%86%E0%A4%9A%E0%A4%BE%E0%A4%B0%E0%A5%8D%E0%A4%AF_%E0%A4%AE%E0%A4%B9%E0%A4%BE%E0%A4%AA%E0%A5%8D%E0%A4%B0%E0%A4%9C%E0%A5%8D%E0%A4%9E,आचार्य महाप्रज्ञ,"आचार्य श्री महाप्रज्ञ (14 जून 1920 – 9 मई 2010) जैन धर्म के श्वेतांबर तेरापंथ के दसवें संत थे।[1] महाप्रज्ञ एक संत, योगी, आध्यात्मिक, दार्शनिक, अधिनायक, लेखक, वक्ता और कवि थे।[2]उनकी बहुत पुस्तकें और लेख उनके पूर्व नाम मुनि नथमल के नाम से प्रकाशित हुई।
उन्होंने दस वर्ष की आयु में जैन संन्यासी के रूप में विकास और धार्मिक प्रतिबिंब का जीवन आरम्भ किया।[3] महाप्रज्ञ ने अनुव्रत आंदोलन में मुख्य भूमिका निभाई जो गुरु आचार्य तुलसी ने 1949 में आरम्भ किया था और 1995 के आंदोलन में स्वीकृत अधिनायक बन गए।[4] आचार्य महाप्रज्ञ ने 1970 के दशक में अच्छी तरह से नियमबद्ध प्रेक्षा ध्यान तैयार किया[5] और शिक्षा प्रणाली में ""जीवन विज्ञान"" का विकास किया जो छात्रों के संतुलित विकास और उसका चरित्र निर्माण के लिए प्रयोगिक पहुँच है।[6]
आचार्य महाप्रज्ञ का जन्म हिन्दू तिथि के अनुसार विक्रम संवत 1977,  आषाढ़ कृष्ण त्रयोदशी को राजस्थान के टमकोर नामक गाँव में हुआ था। उनके पिता का नाम तोलाराम तथा माता का नाम बालू था।  आचार्य महाप्रज्ञ का बचपन का नाम नथमल था। उनके बचपन में पिता का देहांत हो गया था।  माँ बालू ने उनका पालन-पोषण किया। उनकी माँ धार्मिक प्रवृत्ति की महिला थी। इस कारण उन्हें बचपन से ही धार्मिक संस्कार मिले थे।
विक्रम संवत 1987, माघ शुक्ल की दशमी (29 जनवरी 1931) को उन्होंने दस वर्ष की आयु में अपनी माता के साथ तेरापंथ के आचार्य कालूगणी से  दीक्षा ग्रहण की।
आचार्य कालूगणी की आज्ञा से मुनि तुलसी जो आगे चल कर आचार्य कालूगणी के बाद तेरापंथ के नौवें आचार्य बने, के मार्गदर्शन में दर्शन, न्याय, व्याकरण, मनोविज्ञान, ज्योतिष, आयुर्वेद आदि का  तथा  जैन आगम, बौद्ध ग्रंथों, वैदिक ग्रंथों तथा प्राचीन शास्त्रों का गहन अध्ययन किया था।  वे संस्कृत भाषा के आशु कवि थे।
आचार्यश्री तुलसी ने महाप्रज्ञ (तब मुनि नथमल) को पहले अग्रगण्य एवं विक्रम संवत 2022 माद्य शुक्ला सप्तमी (ईस्वी सन् 1965) को हिंसार में निकाय सचिव नियुक्त किया। आगे चल कर उनकी प्रज्ञा से प्रभावित होकर आचार्य तुलसी ने उन्हें महाप्रज्ञ की उपाधि से अंलकृत किया। तब से उन्हें महाप्रज्ञ के नाम से जाना जाने लगा।
विक्रम संवत 2035 राजलदेसर (राजस्थान) मर्यादा महोत्सव के अवसर पर आचार्यश्री तुलसी ने विक्रम संवत 2035 को राजस्थान के राजलदेसर में  उन्हें अपना उत्तराधिकारी घोषित किया। और महाप्रज्ञ युवाचार्य महाप्रज्ञ हो गए।
विक्रम संवत 2050 में राजस्थान के सुजानगढ़ में आचार्य तुलसी ने अपने आचार्य पद का विर्सजन कर दिया और युवाचार्य महाप्रज्ञ को आचार्य नियुक्त किया। और वे तेरापंथ के दसवें आचार्य बने।",,,
1262,List of writers who either speak or write in hindi,https://hi.wikipedia.org/wiki/%E0%A4%B8%E0%A5%87%E0%A4%A0_%E0%A4%97%E0%A5%8B%E0%A4%B5%E0%A4%BF%E0%A4%82%E0%A4%A6_%E0%A4%A6%E0%A4%BE%E0%A4%B8,सेठ गोविंद दास,"सेठ गोविन्ददास  (1896 – 1974) भारत के स्वतंत्रता संग्राम सेनानी, सांसद तथा हिन्दी के साहित्यकार थे। उन्हें साहित्य एवं शिक्षा के क्षेत्र में सन १९६१ में पद्म भूषण से सम्मानित किया गया था। भारत की राजभाषा के रूप में हिन्दी के वे प्रबल समर्थक थे। सेठ गोविन्ददास हिन्दी के अनन्य साधक, भारतीय संस्कृति में अटल विश्वास रखने वाले, कला-मर्मज्ञ एवं विपुल मात्रा में साहित्य-रचना करने वाले, हिन्दी के उत्कृष्ट नाट्यकार ही नहीं थे, अपितु सार्वजनिक जीवन में अत्यंत् स्वच्छ, नीति-व्यवहार में सुलझे हुए, सेवाभावी राजनीतिज्ञ भी थे।
सन् १९४७ से १९७४ तक वे जबलपुर से सांसद रहे। वे महात्मा गांधी के निकट सहयोगी थे। उनको दमोह में आठ माह का कारावास झेलना पड़ा था जहाँ उन्होने चार नाटक लिखे- ""प्रकाश"" (सामाजिक), ""कर्तव्य"" (पौराणिक), ""नवरस"" (दार्शनिक) तथा ""स्पर्धा"" (एकांकी)।
सेठ गोविन्द दास का जन्म संवत 1953 (सन्‌ 1896) को विजयादशमी के दिन जबलपुर के प्रसिद्ध माहेश्वरी व्यापारिक परिवार में राजा गोकुलदास के यहाँ हुआ था। राज परिवार में पले-बढ़े सेठजी की शिक्षा-दीक्षा भी उच्च कोटि की हुई। अंग्रेजी भाषा, साहित्य और संस्कृति ही नहीं, स्केटिंग, नृत्य, घुड़सवारी का जादू भी इन पर चढ़ा।
तभी गांधीजी के असहयोग आंदोलन का तरुण गोविन्ददास पर गहरा प्रभाव पड़ा और वैभवशाली जीवन का परित्याग कर वे दीन-दुखियों के साथ सेवकों के दल में शामिल हो गए तथा दर-दर की ख़ाक छानी, जेल गए, जुर्माना भुगता और सरकार से बगावत के कारण पैतृक संपत्ति का उत्तराधिकार भी गंवाया।
सेठजी पर देवकीनंदन खत्री के तिलस्मी उपन्यासों 'चन्द्रकांता संतति' की तर्ज पर उन्होंने 'चंपावती', 'कृष्ण लता' और 'सोमलता' नामक उपन्यास लिखे, वह भी मात्र सोलह वर्ष की किशोरावस्था में।
साहित्य में दूसरा प्रभाव सेठजी पर शेक्सपीयर का पड़ा। शेक्सपीयर के 'रोमियो-जूलियट', 'एज़ यू लाइक इट', 'पेटेव्कीज प्रिंस ऑफ टायर' और 'विंटर्स टेल' नामक प्रसिद्ध नाटकों के आधार पर सेठजी ने 'सुरेन्द्र-सुंदरी', 'कृष्ण कामिनी', 'होनहार' और 'व्यर्थ संदेह' नामक उपन्यासों की रचना की। इस तरह सेठजी की साहित्य-रचना का प्रारम्भ उपन्यास से हुआ। इसी समय उनकी रुचि कविता में बढ़ी। अपने उपन्यासों में तो जगह-जगह उन्होंने काव्य का प्रयोग किया ही, 'वाणासुर-पराभव' नामक काव्य की भी रचना की।
सन्‌ 1917 में सेठजी का पहला नाटक 'विश्व प्रेम' छपा। उसका मंचन भी हुआ। प्रसिद्ध विदेशी नाटककार इब्सन से प्रेरणा लेकर आपने अपने लेखन में आमूल-चूल परिवर्तन कर डाला। उन्होंने नई तकनीक का प्रयोग करते हुए प्रतीक शैली में नाटक लिखे। 'विकास' उनका स्वप्न नाटक है। 'नवरस' उनका नाट्य-रुपक है। हिन्दी में मोनो ड्रामा पहले-पहल सेठजी ने ही लिखे।
हिन्दी भाषा की हित-चिन्ता में तन-मन-धन से संलग्न सेठ गोविंददास हिन्दी साहित्य सम्मेलन के अत्यन्त सफल सभापति सिद्ध हुए। हिन्दी के प्रश्न पर सेठजी ने कांग्रेस की नीति से हटकर संसद में दृढ़ता से हिन्दी का पक्ष लिया। वह हिन्दी के प्रबल पक्षधर और भारतीय संस्कृति के संवाहक थे।",,,
